I01266013,最好的风景在路上,http://wallpaper.cdn.pandora.xiaomi.com/thumbnail/webp/w1350/MiTv/068e01b51d5dd421da480451e5aaa433e77b5cba2,CC00000005,阅读,愿你的生命中有够多的云翳，来造成一个美丽的黄昏。你是我最珍贵的人生限定。——冰心@图虫创意,['日落', '小米精选']
I01366808,真诚永远是必杀技,http://wallpaper.cdn.pandora.xiaomi.com/thumbnail/webp/w1350/MiTv/04708ad7fccbb4011afbdf9ab4746f6e97bc910ae,CC00000005,阅读,不能等待别人来安排你的人生，要自己去争取和奋斗；而不论其结果是喜是悲，但可以慰藉的是，你总不算白活了一场。有了这样的认识，你就会珍重生活，而不会玩世不恭；同时，也会给人注入强大的力量。——路遥《平凡的世界》@站酷海洛,['丝绸']
I01248132,给自己放个假,http://wallpaper.cdn.pandora.xiaomi.com/thumbnail/webp/w1350/MiTv/09083855b41d84ee70b771e750110f86bdf0a76ac,CC00000005,阅读,放下工作，暂时忘却家庭的琐事，离开每天奋斗的名利场，让自己走进一个安静的世界，无论是山野森林，还是荒漠隔离，亦或者无垠草原，去享受那片刻的宁静。@视觉中国,['优美', '感悟', '秀美', '普罗旺斯', '美景', '小米精选']
I01191319,圆润的世界,http://wallpaper.cdn.pandora.xiaomi.com/thumbnail/webp/w1080/MiTv/0b8444b2c79390c4b5aaf504e53ac36fc87417bc0,CC00000005,阅读,处人不可任己意，要悉人之情；处事不可任己见，要悉事之理。——吕坤@视觉中国,['圆润', '世界', '美景']
I01273249,行走在路上,http://wallpaper.cdn.pandora.xiaomi.com/thumbnail/webp/w1350/MiTv/08b180b5a516b459d9b11004add9cd1c29a1b4164,CC00000005,阅读,生命是一场对话的旅途，与自己对话，与周遭对话，与世界对话。—— 蒋勋 《孤独六讲》@圈子,['冰山', '刺激', '冰川', '旅途']
I01171419,大度是一种善良,http://wallpaper.cdn.pandora.xiaomi.com/thumbnail/webp/w1080/MiTv/084a3419419939997046becbc5667f43efc409fc2,CC00000005,阅读,宽容别人，其实是给自己的心灵让路。只有在宽容的世界里，人才能奏出和谐的生命之歌。@视觉中国,['画画', '莫奈', '文化', '印象派']
I01268884,偷得浮生半日闲,http://wallpaper.cdn.pandora.xiaomi.com/thumbnail/webp/w1350/MiTv/0fea6acc79b4d46e88174a97d30b10b9ca737c41f,CC00000005,阅读,我要你知道，在这个世界上总有一个人是等着你的，不管在什么时候，不管在什么地方，反正你知道，总有这么个人。——张爱玲《半生缘》@圈子,['享受生活', '优美', '花枝', '草木绿']
I01192174,岁月有多漫长？,http://wallpaper.cdn.pandora.xiaomi.com/thumbnail/webp/w1080/MiTv/0b8444b2ce9394c4bdaaf204e13ac86fc37417bc0,CC00000005,阅读,日子只能一天一天好好地过，别无他法。别烦恼明天的事，明天的烦恼明天再烦。我想开心、努力、温柔待人地过完今天一天。——太宰治@视觉中国,['线条', '高铁', '交通']
I01195466,流浪者的乡愁,http://wallpaper.cdn.pandora.xiaomi.com/thumbnail/webp/w1080/MiTv/036c7d5def4da4c8b3022abdaf2cc01857a099d6b,CC00000005,阅读,旅行的意义从不在旅途本身。千山万水，都只为了转身回程的那一个背影，只为了让我们从他乡终于奔赴故乡。——《流浪者的乡愁》@视觉中国,['壮丽', '小镇', '多洛米蒂山脉', '小米精选']
I01293207,晨曦初照,http://package.wallpaper.cdn.pandora.xiaomi.com/mitv/10014/1/f296f7a9c22f1eb6414eabf418944897.jpg,CC00000005,阅读,走出屋外，月仍在中天，但在山边极远极远的天空，有一些早起的晨曦正在云的背后，使灰云有一种透明的趣味。——林清玄 @Unsplash
,['日出', '云海', '早安锁屏']
I01294850,在实践中成长,http://wallpaper.cdn.pandora.xiaomi.com/thumbnail/webp/w1350/MiTv/0cd3fef6861a84b658e7fb5f586710ace9fb42339,CC00000005,阅读,凡不是就着泪水吃过面包的人是不懂得人生之味的人。——歌德《歌德语录》@站酷海洛,['优美']
I01372802,直面人生的痛苦,http://wallpaper.cdn.pandora.xiaomi.com/thumbnail/webp/w1350/MiTv/0137b96ebef81429f8397df0335f7a66addb12968,CC00000005,阅读,对，过去是痛楚的，但我认为你要么可以逃避，要么可以向它学习。——《狮子王》@乐次元,['空旷']
I01222919,清晨的朦胧美,http://wallpaper.cdn.pandora.xiaomi.com/thumbnail/webp/w1080/MiTv/0c5b8427f181b804d86b3b42cf58d8afbc440738a,CC00000005,阅读,时间是由分秒积成的，善于利用零星时间的人，才会做出更大的成绩来。——华罗庚@视觉中国,['时间', '朦胧', '清晨', '早晨', '美景', '成绩']
I01295862,零碎的岛屿会找到海,http://wallpaper.cdn.pandora.xiaomi.com/thumbnail/webp/w1350/MiTv/05dd0ec2a52fa48fb8757d10b40552f75af7c7627,CC00000005,阅读,时间的流逝是平等赋予每个人的疗愈，或许也是救赎。——太宰治《人间失格》@有料,['优美', '清新自然', '海鸥', '治愈']
I01195793,携手远方,http://wallpaper.cdn.pandora.xiaomi.com/thumbnail/webp/w1080/MiTv/08d635b593e362bca33350a2b17c12ab63440831d,CC00000005,阅读,我来不及认真地年轻，待明白过来时，只能选择认真地老去。——三毛@视觉中国,['情侣', '游泳', '游泳池']
I01191320,纯净是种简单,http://wallpaper.cdn.pandora.xiaomi.com/thumbnail/webp/w1080/MiTv/0a844042c79794c411aaf504eb2acc6bcb3b63f7b,CC00000005,阅读,使意志获得自由的唯一途径，就是让意志摆脱任性。——黑尔@视觉中国,['简单', '纯净', '自由']
I01268901,享受属于自己的时光,http://wallpaper.cdn.pandora.xiaomi.com/thumbnail/webp/w1350/MiTv/0ab7037449c5d4a6e91ea7fc50c12d574bd55924b,CC00000005,阅读,想找个保鲜盒，把你给我的那些感动都装起来，当我不那么喜欢你的时候，就拿出来回味一下。——安东尼《这些都是你给我的爱》@圈子,['小屋', '生机勃勃', '小米精选']
I01304813,生命应当像夏花般绚烂,http://wallpaper.cdn.pandora.xiaomi.com/thumbnail/webp/w1350/MiTv/009f164c6a26545548f0396909783ed1b87dca1d7,CC00000005,阅读,我听见回声，来自山谷和心间，用寂寞的镰刀收割空旷的灵魂，不断地重复决绝，又重复幸福，终有绿洲摇曳在沙漠。我相信自己，生来如同绚烂的夏日之花，不凋不败，妖冶如火。——泰戈尔@有料,['优美', '清新自然', '治愈', '放松', '自然现象']
I01274528,生活必须有所归依,http://wallpaper.cdn.pandora.xiaomi.com/thumbnail/webp/w1350/MiTv/07c6aeb2597b54bff8238d2fd2d187a2205977f38,CC00000005,阅读,生活不会像你想象得那么好，但也不会同你想象得那么糟。——莫泊桑@圈子,['桌布', '木桌', '糕点', '甜食']
I01256308,温暖了岁月,http://wallpaper.cdn.pandora.xiaomi.com/thumbnail/webp/w1350/MiTv/095adf178d1db4f029fad349e8b4271b25c777091,CC00000005,阅读,生命是有光的。在我熄灭以前，能够照亮你一点，就是我所有能做的了。——张嘉佳 《云边有个小卖部》@圈子,['优美', '艳丽', '草丛', '寂静']
I01254903,欣赏生活中的风景,http://wallpaper.cdn.pandora.xiaomi.com/thumbnail/webp/w1350/MiTv/0e8e1c5fa51ad44e1adb9dd04f01d775a22aa9b1a,CC00000005,阅读,如作家张淑萍所说：在岁月的长河里，人只有学会适时调节自己，才能在百态的心境里看到百变的风景。心若改变，态度就会改变；态度改变，习惯就会改变；习惯改变，性格就会改变；性格改变，人生就会改变。学会欣赏风景，才能不辜负生活，不辜负自己。@麦拉风/Kelvin李,['知识', '美景', '人生', '小米精选']
I01418155,这个世界并不非黑即白,http://wallpaper.cdn.pandora.xiaomi.com/thumbnail/webp/w1350/MiTv/02c831b44812b487e91a920fb476efc19200ff306,CC00000005,阅读,人不要在说明事实的理论上打圈圈，应该配合理论的说明，慢慢解开事实真相。——阿瑟·柯南·道尔《福尔摩斯全集》@站酷海洛,['雪人', '玩耍', '快乐']
I01209206,永恒的瞬间,http://wallpaper.cdn.pandora.xiaomi.com/thumbnail/webp/w1080/MiTv/0f060257f8ea44b222ffe71d0c52dde44dec30cf7,CC00000005,阅读,时间没有现在，永恒没有未来，也没有过去。——丁尼生@视觉中国,['瞬间', '麻雀']
I01172371,未来可期,http://wallpaper.cdn.pandora.xiaomi.com/thumbnail/webp/w1080/MiTv/08960c593d29f4e5a12c9a5481ba8884579e9e299,CC00000005,阅读,道路险阻，爱是无畏，所有的汗水和足迹都不会被辜负。@视觉中国,['道路', '未来', '挑战', '汗水']
I01266476,站在高处才能望到远方,http://wallpaper.cdn.pandora.xiaomi.com/thumbnail/webp/w1350/MiTv/0135d21616abf4427967ac1596c077ec003d6ca96,CC00000005,阅读,问一问你的心，只要它答应，没有地方，是到不了的那么远。——三毛 @视觉中国,['电视塔', '早安锁屏']
I01319010,减法的哲学,http://wallpaper.cdn.pandora.xiaomi.com/thumbnail/webp/w1350/MiTv/05f3b38263d034e4483b3036a139b91fba0422874,CC00000005,阅读,断舍离生活与其说是整理物品，不如说是整理人生，我们在这个过程中会逐渐明白，要放下不适合的人事物，才能专心做自己、迎来真正的幸福。——《断舍离》@圈子,['夜空', '黄昏', '路灯', '傍晚', '孤寂']
I01192595,动静融合,http://wallpaper.cdn.pandora.xiaomi.com/thumbnail/webp/w1080/MiTv/0b9fe4e6df4ef8f5be306a782bdbb902cd842c3bd,CC00000005,阅读,故声无小而不闻，行无隐而不形。——荀子@视觉中国,['海岸', '海边', '海浪', '美景']
I01372857,你是我的救赎,http://wallpaper.cdn.pandora.xiaomi.com/thumbnail/webp/w1350/MiTv/024759eb78abd44809204fa72ab6e62cdda60ec37,CC00000005,阅读,爱，不是要去寻找一个完美的人，而是学会用完美的眼光，欣赏那个并不完美的人。因为爱你，只要你一个肯定，我就足够勇敢。——《哈尔的移动城堡》@乐次元,['优美', '空旷']
I01171417,与友为伴,http://wallpaper.cdn.pandora.xiaomi.com/thumbnail/webp/w1080/MiTv/09960c593d2cf4e5612c9a54811a8886579e3e299,CC00000005,阅读,人生只不过短短数十载，人缘，不是有多少人认识你，而是有多少人愿意帮助你。@视觉中国,['险峻', '旅游', '美景']
I01183392,人生的选择,http://wallpaper.cdn.pandora.xiaomi.com/thumbnail/webp/w1080/MiTv/009a9d45bb5104b9d370304318f236317a94448e5,CC00000005,阅读,乐人之乐，人亦乐其乐；忧人之忧，人亦忧其忧。——白居易@视觉中国,['马路', '道路', '红绿灯', '选择', '人生']
I01200352,宽广的世界,http://wallpaper.cdn.pandora.xiaomi.com/thumbnail/webp/w1080/MiTv/0c78cf4c790204f58238ce2283aca6455235c0fd5,CC00000005,阅读,生活的道路一旦选定，就要勇敢地走到底，决不回头。——左拉@视觉中国,['道路', '太阳', '大地']
I01259456,幸而遇见,http://wallpaper.cdn.pandora.xiaomi.com/thumbnail/webp/w1350/MiTv/0aefb8d6d66b647e4ae71d0c4d06411ae7b5ab65a,CC00000005,阅读,生命和生命的连结组成一个故事，一个灵魂会唤醒另一个灵魂。——米奇·阿尔博姆 @Unsplash,['小船', '航拍', '清凉', '早安锁屏']
I01365385,寻找浪漫的微光,http://wallpaper.cdn.pandora.xiaomi.com/thumbnail/webp/w1350/MiTv/09a1327785cf547b3a724766141ecc2281144fc17,CC00000005,阅读,论天空如何阴霾，太阳一直都在，不在这里就在那里。——丁立梅@水象星,['神秘']
I01170885,灿烂的人生,http://wallpaper.cdn.pandora.xiaomi.com/thumbnail/webp/w1080/MiTv/0ecde45581e6b4190b3e403fc2fcd46368441ef42,CC00000005,阅读,我现在所做的，只是为以后不会后悔，只是为以后那更加灿烂的人生。@视觉中国,['情感', '读书', '灿烂', '人生']
I01194780,享受时光,http://wallpaper.cdn.pandora.xiaomi.com/thumbnail/webp/w1080/MiTv/0b6c757de84aaac8010223bda49cc41d59f436f0d,CC00000005,阅读,不要为已消尽之年华叹息，必须正视匆匆溜走的时光。——朗费罗@视觉中国,['生机勃勃', '剪纸', '树叶', '时光']
I01172374,无惧风浪,http://wallpaper.cdn.pandora.xiaomi.com/thumbnail/webp/w1080/MiTv/099605793929fbe5e72c935484ea848250d41918c,CC00000005,阅读,奋斗之路不可能都是坦途，它的上面有时布满了荆棘。 @视觉中国,['未来', '挑战', '成长', '人生', '奋斗']
I01420060,关于宇宙的奇思妙想小说,http://wallpaper.cdn.pandora.xiaomi.com/thumbnail/webp/w1350/MiTv/0020d647883eb4f5fa420704e68f839b6dfa2fc8b,CC00000005,阅读,《沙丘》是一部描绘未来宇宙的奇幻小说，讲述了一个发生在沙漠星球阿拉吉斯的故事。在这个星球上，人们为了争夺一种名为“香料”的珍贵资源，展开了一场激烈的权力斗争。小说中，赫伯特创造了一个充满异域风情的沙漠世界，以及各种神秘的政治势力。@锐景,['魅力', '宇宙', '行星', '昏暗']
